{
  "schema_version": "2.0",
  "form_id": "prepod_vnok_info",
  "date_filled": "07.10.2026",
  "teacher": {"full_name": "Вымышленный Алексей Петрович", "position": "Доцент", "department": "Кафедра прикладной математики"},
  "students": [{
    "id": "student-example-1",
    "last_name": "Примеров",
    "first_name": "Иван",
    "middle_name": "Сергеевич",
    "course": "3",
    "group_code": "001-НИР-А",
    "phone": "+00 (012) 003-04-05",
    "email": "student@example.org",
    "task": "Изучить методы обработки экспериментальных данных.\nПодготовить сравнительный отчёт.",
    "schedule": "Консультации: понедельник и среда, 14:00–15:30, ауд. 012-А.\nСамостоятельная работа: пятница, 10:00–12:00, лаборатория 2.",
    "expected_results": "Отчёт и доклад на учебном семинаре.",
    "status": "Провожу эксперимент",
    "achievements": [
      {"id": "achievement-1", "text": "Подготовлен обзор литературы."},
      {"id": "achievement-2", "text": "Представлен промежуточный доклад."}
    ],
    "notes": ""
  }]
}
